{"accessBoundary":{"candidateGenerated":false,"finalBodiesInstantiated":false,"gateBodiesInstantiated":false,"multiCauseBodiesInstantiated":false,"promotionEvaluated":false,"realProviderCalled":false},"claims":{"attributionAccuracyMeasured":false,"harnessImprovementMeasured":false,"researchEvidenceAuthorized":false,"runtimeSemanticFidelityValidated":true,"selfEvolutionDemonstrated":false},"datasetRole":"mine","evidenceClass":"deterministic_semantic_development_validation","labelBlindBoundary":{"corpusHash":"sha256:49f7dcbfaabdc122294b41f30d56f15d5eca6088d7941f07483968bdd58e1a01","forbiddenValueLeakCount":0,"inputOrderInvariant":true,"opaqueIdRenameInvariant":true,"oracleImportsInAdapterModule":0,"oracleImportsInExecutionModule":0,"validatedTraceCount":28},"schemaVersion":1,"semanticValidation":{"behaviorDivergedBeforeVerificationCount":28,"faultyFailCount":28,"faultyReplayStableCount":28,"goodReplayStableCount":28,"groundTruthRestorePassCount":28,"immutableDiffCount":0,"knownGoodPassCount":28,"nonGroundTruthRestoreFailCount":28,"singleChangedComponentCount":28,"validatedFixtureCount":28},"sourceCommit":"709b7974ae1434e07a576a7145b08e3b90b7efe4","specVersion":"hfb-semantic-development-1.0.0","suiteCommitment":{"authorityBoundary":{"attributionPerformanceClaim":false,"executionPackagesContainLabels":false,"oracleSeparatedFromExecution":true,"proposerInputRequiresLabelBlindAdapter":true,"selfEvolutionClaim":false},"commitmentHash":"sha256:61c5f01ecb135436df55a76d169a26dac48379d18f31eb8e7d78e04a4e9c40be","datasetRole":"mine","entries":[{"executionPackageHash":"sha256:5e5ddbe9cd962b1323432bd89db1ee787133c4507abec2f6c9870e9a0995b3fc","faultyEventChainHash":"sha256:c0c1f8cc19f283a186bbde2bdc50e5fa10cd3630a1b1a488a90926c8353fd3e2","fixtureId":"hfb-v0-context-policy-01","knownGoodEventChainHash":"sha256:7ef248fd64d4c18b38b5e5192055978e93a84a570efdc397fc69fc89b30533d1","oracleHash":"sha256:1b5fb3504db97f9d0f8e5794b77e68a5e8baca6a0110328147f9da75999443f2","validationReportHash":"sha256:4b5ecd820f76e19967a539c3684e5af253548d104f1f0002e3be5307c61b3fb8"},{"executionPackageHash":"sha256:6d29aca1d60b7cfa6d08e68097d5344d6586f2511fd6b2c1a22c50f93b1bf264","faultyEventChainHash":"sha256:132c0b05ead16e3223f9147132eb7000865acc26094380617c906974eaa2fbe6","fixtureId":"hfb-v0-context-policy-02","knownGoodEventChainHash":"sha256:a98faa8c7945641f1ed77f92f38596cd10012d50a3b8d2b82c8c6e0926f9ff72","oracleHash":"sha256:de502d2ce70c930fbd9f75833f5ff0e08c9265d9ff3e05598350396a7239592c","validationReportHash":"sha256:363cb3232ceaf029e1466514c466a90263a0cebb9925ecf53db9c11963fa8cc6"},{"executionPackageHash":"sha256:a0b30a78dfd65d52b19189a6ab231a16d5887d47f0f78c3b6ace705dd9eee9e1","faultyEventChainHash":"sha256:e88f749424ce3ab4dfc8435a27129e972b8f97fae7b62ec04474296c73dfcb96","fixtureId":"hfb-v0-context-policy-03","knownGoodEventChainHash":"sha256:36ceb0446fc11209da23998f807f1292b66aaa04b07991b239ab00eaeeda7970","oracleHash":"sha256:dd321638484fe78e448058e5e8c580efc9111e3cb3f87c543882280d0d5107c5","validationReportHash":"sha256:7c4f4a75f3f10ff66d1b7a0d7082b1cee2e88d71c5a5aebb381907166f1db1fb"},{"executionPackageHash":"sha256:cc5f71b857f5813e507d5fb060df4b616ff8549a4eeccbbc3041efc66b2f60c8","faultyEventChainHash":"sha256:facac49abd2e02efc999f487b381369cb9d1c2d68dafd54292db272ad67344d6","fixtureId":"hfb-v0-context-policy-04","knownGoodEventChainHash":"sha256:db718757ada469672f362c47ffcc9a4dc593c46715b898e8e456382bd72a3756","oracleHash":"sha256:9557ae3b9ba1ca4c88a7e68bf61c3d36e20ac7bbff975c8c36402cbcf4dd5c31","validationReportHash":"sha256:596dda3f3f5468a42124197345a87f67e7beefb8e859d1252bd52308e0111400"},{"executionPackageHash":"sha256:847d291add80f05ebfdeaec17d1efeebcd0c9d9e461b7814810d578a8c429ea3","faultyEventChainHash":"sha256:bb15c2374d95db954b7973a90e7e26b55bb05a4e26e7bc14807735768aeb599f","fixtureId":"hfb-v0-memory-retrieval-policy-01","knownGoodEventChainHash":"sha256:d6c344faa9c6c61d808074a465680f14def1a25cff2e6147774aaff4a751a141","oracleHash":"sha256:5272854ab81ef9894f9b709aecb17fc37847e040e1e073628abbb6b99788ca50","validationReportHash":"sha256:d4a0b4157e03610c245ad457c5fa6048bb9e1117c1f3354338e2874e95cc9fcd"},{"executionPackageHash":"sha256:847d291add80f05ebfdeaec17d1efeebcd0c9d9e461b7814810d578a8c429ea3","faultyEventChainHash":"sha256:3522d7e3928ba9f6930c69d605c34f358c5342ef07c79ce8376b30b297008208","fixtureId":"hfb-v0-memory-retrieval-policy-02","knownGoodEventChainHash":"sha256:5ec9fbea0b1f2be3e8eb16ae01e38316e5954589da683100bffd8d3508b62864","oracleHash":"sha256:386f8e10455da549d29fc8987e18b73f1bd5641387163886e6c082c5ec269114","validationReportHash":"sha256:2f62c87902131d262a29e4fea548f9f731781a41c711716c4ac0522b6ae73b1e"},{"executionPackageHash":"sha256:847d291add80f05ebfdeaec17d1efeebcd0c9d9e461b7814810d578a8c429ea3","faultyEventChainHash":"sha256:cf0337ade4ac408db71f6e563fdced13fba0107987f15913732259ce2df9d5a6","fixtureId":"hfb-v0-memory-retrieval-policy-03","knownGoodEventChainHash":"sha256:c939a52cf94e73d5a2f53754ae8b03abdfa312aceb92a350eebcbab957ecac12","oracleHash":"sha256:33ad0e9a3b001fd252c9cb22b7b621ebdfeb7db63f39e21400421f412a7d3e50","validationReportHash":"sha256:2fff49883afdecc1e9c1edf4a8444a7938d8fa3bd35f2eff4ed38b0a40d0ece0"},{"executionPackageHash":"sha256:847d291add80f05ebfdeaec17d1efeebcd0c9d9e461b7814810d578a8c429ea3","faultyEventChainHash":"sha256:4e72c65baac5ca1535db1aee7b79fcf8335541f0bc497231fc0962e092ffdf71","fixtureId":"hfb-v0-memory-retrieval-policy-04","knownGoodEventChainHash":"sha256:fcede1752548fcf16d868dcb6a49e0b5c22a84b2a1d89cf1bcf3634b77cd1a94","oracleHash":"sha256:206c31470810c75fd1e0d89f81728de4ecf2de72197463fb32ed66bf601a0ba5","validationReportHash":"sha256:5ae33392f23b013158b175ec6abde97d270b0c40b9c00cdaba0f66308b9e9452"},{"executionPackageHash":"sha256:f2360f478369af033ef29be1a971bc17ad4a7b5df54f7c4dbe33f5626394c5f0","faultyEventChainHash":"sha256:f92ccba8849bea3299c7a8f0db7a1a61631546844671b018bf700fc710abeed0","fixtureId":"hfb-v0-routing-subagent-01","knownGoodEventChainHash":"sha256:c29f56af5cbb1238d12649ca36138b0f24e70003806b1a3747ef7ba09355fff8","oracleHash":"sha256:c3c37e45bec48d45d8c4205623559e270cdd6810011c86f0281de7a426bbe5e8","validationReportHash":"sha256:01c27ee4520c17c62b1bae17eaa1cf3359fb36ad5feac9d1e1729af9f7eca210"},{"executionPackageHash":"sha256:cbcc9ac89e395f4af2d8f0ba4f5dca9e51d4793b10f30cd1e85c774b8f27eadf","faultyEventChainHash":"sha256:75c72c48b9371ec895fef5caeab57ff0a4fa0f9975167320bbfd33f8525e2111","fixtureId":"hfb-v0-routing-subagent-02","knownGoodEventChainHash":"sha256:ad801712e5c3d77e239fa849a6a8040c9cc2e085c89289309d34a34248963f41","oracleHash":"sha256:7b379fb1ef3b0e08b092bf7fda6f64d0c46cb205106847b350031bedfffb6b14","validationReportHash":"sha256:410c443537f4c62dcf2b069a448848b987451cc1f8d5962b99950bb5531e43b1"},{"executionPackageHash":"sha256:57fc758ce7a4c4faef2bd7d3f7ad2bacfdec3e4bf9e66567b2533d9add1afd76","faultyEventChainHash":"sha256:b3b05f64cbefc238f6e6520765298ace7ab94d8c2d451fae64dfb52e6f7ee455","fixtureId":"hfb-v0-routing-subagent-03","knownGoodEventChainHash":"sha256:fe230cf047adf17b3ce40724c346a9b14f1cc169c5c9e946d3f183a8b9d6ca1e","oracleHash":"sha256:24379ed6fb1953a3cc27c461033f6f2287f751294e9b0033f5cf8ab2cf71104d","validationReportHash":"sha256:a3664b0be995569b2c95b6bc74206d9825d2d6dd59d6c092f2f3e2e4705d0cf2"},{"executionPackageHash":"sha256:dfb76ea0ab7f409fdcdc7f58b37d875ecec5268527ef8ff2da45167136aff272","faultyEventChainHash":"sha256:2fada9831e47a9317f666609a8cf11c3cffde013341f4f2f68f655b24e78ab52","fixtureId":"hfb-v0-routing-subagent-04","knownGoodEventChainHash":"sha256:8aea28619bff02e469ac29186ccc0e931519035abe6d08490cd2b14801ac81ba","oracleHash":"sha256:5b0f3217e4446a4665a09e87a7d4533cc659c5b5285761a64369baeebb4e03f1","validationReportHash":"sha256:b843f989cfdc1cc1be2cf3d9a01bac90866a5a01f0e160b4daa723ada47d2771"},{"executionPackageHash":"sha256:b730ec69339fbc56adbb63f5f55baf555ec9943497f1c0938d1e4d11aebae53e","faultyEventChainHash":"sha256:17f9baf24b0a57e6ec655c72b9a08976333de57af3d560cedcd53a8f22dc3e9b","fixtureId":"hfb-v0-skill-01","knownGoodEventChainHash":"sha256:eed39cebd371a61e7aca7ceabe6b493994fbf123c83e52cae688b88916c27733","oracleHash":"sha256:3f70535f3353086e790d287a181c44a6a2adba43461ad43ce194f4a3441367e3","validationReportHash":"sha256:5dea3adf2b7129a3085a25d24d752037ec8a2a660f260e6e0930ce0699fe4560"},{"executionPackageHash":"sha256:b730ec69339fbc56adbb63f5f55baf555ec9943497f1c0938d1e4d11aebae53e","faultyEventChainHash":"sha256:90c7c523fd216787d225fd5ba57b9c7db61570b15499155d99e0695ec0654d6d","fixtureId":"hfb-v0-skill-02","knownGoodEventChainHash":"sha256:a639ec5de760a3747fcefa5c9c3793162fc181c1df6b38c0a2cac0ef2e6d5435","oracleHash":"sha256:3b2d233284c8478eb85dc0694ff707e8a1a11d06ab1ffe45455dfde16fc2a51e","validationReportHash":"sha256:704f65b1209c47df04c51a750ac41250ef6eca242f4d0d832e119fc3f1821b59"},{"executionPackageHash":"sha256:b730ec69339fbc56adbb63f5f55baf555ec9943497f1c0938d1e4d11aebae53e","faultyEventChainHash":"sha256:a539c4d86cd2791e6fedcd036bb1138ac627a6207f4fd1fee9eb45a3d4726093","fixtureId":"hfb-v0-skill-03","knownGoodEventChainHash":"sha256:5b301d84e1830e60efd43dfb8709cb8ee949cd6d091f8710a27b274e74e4ffce","oracleHash":"sha256:15c2077a1a4f8a8736d19c186cf027897965a183b4af582811462c9cd9bbfd0e","validationReportHash":"sha256:91e972095fc7215a2afb7cbdcf34e30508244c805502dc8795724856e7b62526"},{"executionPackageHash":"sha256:b730ec69339fbc56adbb63f5f55baf555ec9943497f1c0938d1e4d11aebae53e","faultyEventChainHash":"sha256:7da64f7fb6a6f3e5f25eca3ffd54da66888a8251d105d2a633e4f5bf2af6b0ab","fixtureId":"hfb-v0-skill-04","knownGoodEventChainHash":"sha256:9d8d2a6c923614d149e46a97357951d2b37c4c66d5ab9c2b30fe401578c76b0f","oracleHash":"sha256:6303e1d84e445c378d92d3231ed16d9d5d310d0d6cfa6c551ba8af9d861a8ad4","validationReportHash":"sha256:52360c64573bddb892222d18c955ae46751371e6999c8e70f161b00ce641da3f"},{"executionPackageHash":"sha256:cd79e98228cee083b12e03005828386ea35b1f150d90b3ac0e896d8796121c06","faultyEventChainHash":"sha256:7